edid-decode (hex):

00 ff ff ff ff ff ff 00 18 89 f4 70 0b 00 00 00
34 1a 01 03 81 0f 09 78 e7 81 96 a6 52 52 9c 26
0f 4f 54 00 00 00 01 00 01 01 01 01 01 01 01 01
01 01 01 01 01 01 4e 0c 20 c8 30 e0 2d 10 5a 64
32 08 96 5a 00 00 00 14 00 00 00 fe 00 52 65 76
20 31 2e 31 0a 20 20 20 20 20 00 00 00 fc 00 45
4c 49 37 30 2d 49 78 48 57 0a 20 20 00 00 00 fd
00 3c 45 1f 24 04 00 0a 20 20 20 20 20 20 01 14

02 01 00 00 00 00 00 00 00 00 00 00 00 00 00 00
00 00 00 00 00 00 00 00 00 00 00 00 00 00 00 00
00 00 00 00 00 00 00 00 00 00 00 00 00 00 00 00
00 00 00 00 00 00 00 00 00 00 00 00 00 00 00 00
00 00 00 00 00 00 00 00 00 00 00 00 00 00 00 00
00 00 00 00 00 00 00 00 00 00 00 00 00 00 00 00
00 00 00 00 00 00 00 00 00 00 00 00 00 00 00 00
00 00 00 00 00 00 00 00 00 00 00 00 00 00 00 fd

----------------

Block 0, Base EDID:
  EDID Structure Version & Revision: 1.3
  Vendor & Product Identification:
    Manufacturer: FDI
    Model: 28916
    Serial Number: 11
    Made in: week 52 of 2016
  Basic Display Parameters & Features:
    Digital display
    DFP 1.x compatible TMDS
    Maximum image size: 15 cm x 9 cm
    Gamma: 2.20
    DPMS levels: Standby Suspend Off
    Monochrome or grayscale display
    Default (sRGB) color space is primary color space
    First detailed timing is the preferred timing
    Supports GTF timings within operating range
  Color Characteristics:
    Red  : 0.6503, 0.3203
    Green: 0.3203, 0.6103
    Blue : 0.1503, 0.0595
    White: 0.3095, 0.3300
  Established Timings I & II: none
  Standard Timings:
  Detailed Timing Descriptors:
    DTD 1:   800x480    60.000 Hz   5:3    31.500 kHz  31.500 MHz (digital composite, serrate, 150 mm x 90 mm)
                 Hfront   90 Hsync 100 Hback  10 Hpol N
                 Vfront   35 Vsync   2 Vback   8
    Alphanumeric Data String: 'Rev 1.1'
    Display Product Name: 'ELI70-IxHW'
  Display Range Limits:
    Monitor ranges (GTF): 60-69 Hz V, 31-36 kHz H, max dotclock 40 MHz
  Extension blocks: 1
Checksum: 0x14

----------------

Block 1, CTA-861 Extension Block:
  Revision: 1
Checksum: 0xfd
